{
  "scenario": "revocation-delay",
  "injection": "delayed_revocation_broadcast",
  "data_source": "real",
  "fulcrum_commit": "5c86a3517f803f525041d826dfc17ea497bbd147",
  "scenario_hash": "9462ebdeff7543fbcd1e3ce38ddb285659e495130fab960dfdb51f7b2f9b6f90",
  "evidence_class": "measured",
  "revocation_window_ms": 297.38,
  "safety_violations": 0,
  "recovery_time_ms": 242.545,
  "within_bounds": true,
  "expected_bounds": {
    "max_revocation_window_ms": 500.0,
    "max_safety_violations": 0
  },
  "metadata": {
    "iterations": 500,
    "generated_at": "2026-02-20T10:18:44Z",
    "mode": "real-ghz",
    "seed": 0
  }
}