{
  "scenario": "stale-proof-replay",
  "injection": "replay_stale_proof_token",
  "data_source": "real",
  "fulcrum_commit": "5c86a3517f803f525041d826dfc17ea497bbd147",
  "scenario_hash": "db8b4b020bc9e5cedbb9d61b2896b836631355c0ef4c4eae38ced26555c26bb0",
  "evidence_class": "measured",
  "revocation_window_ms": 349.906,
  "safety_violations": 0,
  "recovery_time_ms": 215.844,
  "within_bounds": true,
  "expected_bounds": {
    "max_revocation_window_ms": 500.0,
    "max_safety_violations": 0
  },
  "metadata": {
    "iterations": 300,
    "generated_at": "2026-02-20T10:19:26Z",
    "mode": "real-ghz",
    "seed": 0
  }
}